{
  "$schema": "https://orientation.finlaymccall.com/ai/course.schema.v1.2.json",
  "schema_version": "1.2",
  "id": "human-ai-orientation-useful-context",
  "title": "Human AI Orientation",
  "context_version": "2026-10-23.1",
  "updated": "2026-10-23",
  "status": "Public reading with invitation-only account access; broader registration is not open.",
  "authentication_required": false,
  "context_url": "https://orientation.finlaymccall.com/ai/releases/2026-10-23.1/context.md",
  "latest_context_url": "https://orientation.finlaymccall.com/ai/context.md",
  "human_guide_url": "https://orientation.finlaymccall.com/ai/",
  "learner_lesson_url": "https://orientation.finlaymccall.com/journey",
  "saved_progress_url": "https://orientation.finlaymccall.com/local/orientation/index.php",
  "github_url": "https://github.com/drfinlaymccall/human-ai-orientation",
  "content_license": "https://creativecommons.org/licenses/by/4.0/",
  "license_scope_url": "https://orientation.finlaymccall.com/deeper-courses#course-licence",
  "github_status": "Public source, design history and issue tracking.",
  "ai_browsing_required": false,
  "fallback": "If your AI cannot read a link, paste the context text below into the chat. If you cannot use an AI today, use the worked example in the public lesson. Neither AI browsing nor a GitHub account is a completion requirement.",
  "learning_outcomes": [
    "Identify a small useful task and a sign of success.",
    "Choose relevant context and explain what to leave out.",
    "Distinguish private notes, the current conversation and product-specific saved context.",
    "Check an AI result, ask for a correction and retain or revise reusable guidance.",
    "Build and review working preferences, project context and knowledge/source notes; download and restore them.",
    "Select useful context for a fresh conversation, check its result, and retain a next goal and first step."
  ],
  "steps": [
    {
      "id": "first-task",
      "title": "Try AI on a useful task",
      "guidance": "At /first-task choose a small worthwhile task, a checkable criterion and a first attempt. Use your own notes or the fictional example."
    },
    {
      "id": "choose",
      "title": "Choose something worth doing",
      "guidance": "Ask what small task would help and what a useful result would look like. If they prefer, use the fictional community event with an undecided date and venue."
    },
    {
      "id": "understand",
      "title": "See what context changes",
      "guidance": "Contrast a vague request with one that specifies audience, missing details and a constraint. Distinguish their own notes, this chat, and saved instructions or memory."
    },
    {
      "id": "brief",
      "title": "Build a small context brief",
      "guidance": "Help them state task, purpose, audience, useful background, boundaries and a success criterion. Ask which detail they included or omitted and why. Ask them to predict one difference the context should make."
    },
    {
      "id": "try",
      "title": "Try it, check it, improve it",
      "guidance": "Respond to their chosen small task, then invite them to compare the result with their criterion. Help check missing or invented information and make one correction. State uncertainty. Do not pretend the course example is a real event."
    },
    {
      "id": "reuse",
      "title": "Keep instructions they can reuse",
      "guidance": "Help separate general working preferences from project-specific details. Let them choose an instruction to keep or revise, based on the result. Instruction files are an optional extension, not a requirement."
    },
    {
      "id": "check",
      "title": "Check understanding",
      "guidance": "Ask how they would check what context an AI has in a new conversation. Wait for their reasoning before feedback. Do not treat an AI's claim about its memory as a complete audit."
    },
    {
      "id": "reflect",
      "title": "Keep what they learned",
      "guidance": "Invite a short reflection: task; included or omitted context and why; prediction and observation; an instruction kept or revised; a next use. The human writes it and decides whether to return to Moodle to submit it. Completion records practice, not mastery."
    },
    {
      "id": "portfolio",
      "title": "Save your context for next time",
      "guidance": "At /portfolio write working preferences, project details and knowledge/source notes yourself or use the optional AI interview. Review every claim. Download Markdown for reading and a versioned JSON backup for restoring. Private practice notes are excluded from context exports but included in the private backup. The browser draft is temporary; Moodle does not store it."
    },
    {
      "id": "continue",
      "title": "Check a result and plan your next step",
      "guidance": "At /check-and-continue begin with an existing brief, a restored portfolio backup or the fictional example. Select relevant context and try one small task in a fresh conversation. Product memory may still apply. Judge the result against your own criterion, correct or keep an instruction, and record your next goal, human learning need, information the AI needs, and first step. Practice records remain private."
    }
  ],
  "saved_progress_authentication_required": true,
  "progress_description": "Activity practice, not a graded assessment or a statement of mastery.",
  "baseline_version": 1,
  "baseline_slugs": [
    "first-task",
    "useful-context",
    "check-and-continue"
  ],
  "activities": [
    {
      "slug": "first-task",
      "label": "Try AI on a useful task",
      "version": "1.0.0",
      "updated_at": "2026-10-23",
      "outcomes": [
        "A first result and a way to judge it."
      ],
      "role": "core",
      "baseline": true,
      "optional": false,
      "public_url": "https://orientation.finlaymccall.com/first-task",
      "support_links": []
    },
    {
      "slug": "useful-context",
      "label": "Give AI the right background",
      "version": "1.0.0",
      "updated_at": "2026-10-23",
      "outcomes": [
        "A reusable context brief."
      ],
      "role": "core",
      "baseline": true,
      "optional": false,
      "public_url": "https://orientation.finlaymccall.com/preview",
      "support_links": []
    },
    {
      "slug": "portfolio",
      "label": "Save your context for next time",
      "version": "1.0.0",
      "updated_at": "2026-10-23",
      "outcomes": [
        "A reviewed personal context portfolio."
      ],
      "role": "portfolio-bridge",
      "baseline": false,
      "optional": false,
      "public_url": "https://orientation.finlaymccall.com/portfolio",
      "support_links": []
    },
    {
      "slug": "check-and-continue",
      "label": "Check a result and plan your next step",
      "version": "1.0.0",
      "updated_at": "2026-10-23",
      "outcomes": [
        "A checked result, an improvement and a next-step plan."
      ],
      "role": "core",
      "baseline": true,
      "optional": false,
      "public_url": "https://orientation.finlaymccall.com/check-and-continue",
      "support_links": []
    },
    {
      "slug": "before-you-start",
      "label": "Files, notes and AI basics \u2014 optional help",
      "version": "1.0.0",
      "updated_at": "2026-10-23",
      "outcomes": [
        "Files and notes you can find again, and an available AI input route."
      ],
      "role": "optional-preparation",
      "baseline": false,
      "optional": true,
      "public_url": "https://orientation.finlaymccall.com/before-you-start",
      "support_links": [
        {
          "label": "Set up your notes",
          "url": "https://orientation.finlaymccall.com/notes"
        }
      ]
    }
  ]
}
